{"ai_image_url":"https://www.tasteslikegood.org/api/recipes/eea566bb-41ef-46c2-9d29-cd4cb2c30e9d/image","breadcrumbs":[{"name":"Home","url":"https://www.tasteslikegood.org/"},{"name":"Browse","url":"https://www.tasteslikegood.org/browse"},{"name":"Vegan Comfort Food Recipes","url":"https://www.tasteslikegood.org/browse/tag/comfort-food"},{"name":"Ultimate Vegan Grilled Cheese with Tomato and Basil","url":"https://www.tasteslikegood.org/r/ultimate-vegan-grilled-cheese-with-tomato-and-basil"}],"cookTime":10,"description":"Golden, crispy sourdough loaded with gooey melted vegan cheddar, creamy plant-based mozzarella, juicy seasoned tomatoes, and aromatic fresh basil.","id":"eea566bb-41ef-46c2-9d29-cd4cb2c30e9d","image":"https://www.tasteslikegood.org/api/recipes/eea566bb-41ef-46c2-9d29-cd4cb2c30e9d/image","ingredients":{"dry":[{"amount":0.5,"name":"Dried oregano","units":"tsp"},{"amount":0.25,"name":"Garlic powder","units":"tsp"},{"amount":0.25,"name":"Flaky sea salt","units":"tsp"},{"amount":0.25,"name":"Black pepper","notes":"freshly ground","units":"tsp"}],"other":[{"amount":4,"name":"Sourdough bread","notes":"medium thickness","units":"slices"},{"amount":4,"name":"Vegan cheddar slices","units":"slices"},{"amount":4,"name":"Vegan mozzarella or provolone slices","units":"slices"},{"amount":6,"name":"Fresh basil leaves","units":"qty"}],"wet":[{"amount":2,"name":"Vegan butter","notes":"softened at room temperature","units":"Tbsp"},{"amount":1,"name":"Dijon mustard","notes":"optional for extra tang","units":"tsp"},{"amount":1,"name":"Ripe beefsteak or heirloom tomato","notes":"cut into 1/4-inch thick slices","units":"large"}]},"instructions":["Place tomato slices onto a double layer of paper towels and blot them gently to absorb excess moisture. Season both sides with dried oregano, garlic powder, salt, and black pepper.","Spread softened vegan butter evenly on one side of each slice of bread. Turn two slices over and spread Dijon mustard on the unbuttered sides.","Assemble the sandwiches: on top of the mustard-spread side, layer one slice of vegan cheddar, one slice of vegan mozzarella, seasoned tomato slices, fresh basil leaves, followed by another slice each of cheddar and mozzarella. Top with the remaining bread slices, buttered side facing up.","Preheat a large skillet or cast-iron pan over medium-low heat. Place the sandwiches into the skillet.","Cover the skillet with a lid and cook for 3 to 4 minutes. Covering helps trap steam, ensuring the plant-based cheese melts fully without burning the bread.","Remove the lid, carefully flip the sandwiches, and press gently with a spatula. Cook uncovered for another 3 to 4 minutes until both sides are golden-brown and crisp, and the cheese is thoroughly melted.","Transfer to a cutting board, let rest for 1 minute so the cheese sets slightly, slice diagonally, and serve immediately."],"is_public":true,"name":"Ultimate Vegan Grilled Cheese with Tomato and Basil","notes":"Drying the tomato slices with a paper towel is the secret to avoiding a soggy sandwich. For maximum melt, stick to low-and-slow heat with the skillet covered for the first half of cooking.","prepTime":10,"servings":2,"slug":"ultimate-vegan-grilled-cheese-with-tomato-and-basil","stock_image_url":null,"tags":["vegan","sandwich","grilled cheese","comfort food","quick lunch","plant-based"]}
