{"ai_image_url":"https://www.tasteslikegood.org/api/recipes/807da7cd-6eae-4648-ae31-2910bb2e3281/image","breadcrumbs":[{"name":"Home","url":"https://www.tasteslikegood.org/"},{"name":"Browse","url":"https://www.tasteslikegood.org/browse"},{"name":"Vegan Snacks and Appetizers","url":"https://www.tasteslikegood.org/browse/tag/snacks"},{"name":"Steamed Nepalese Vegetable Momos","url":"https://www.tasteslikegood.org/r/steamed-nepalese-vegetable-momos"}],"cookTime":15,"description":"Authentic Nepalese dumplings packed with finely minced spiced vegetables, wrapped in delicate homemade dough, and steamed to perfection. Served with a spicy tomato-sesame achar.","id":"807da7cd-6eae-4648-ae31-2910bb2e3281","image":"https://www.tasteslikegood.org/api/recipes/807da7cd-6eae-4648-ae31-2910bb2e3281/image","ingredients":{"dry":[{"amount":250,"name":"all-purpose flour","notes":"plus extra for dusting","units":"g"},{"amount":1,"name":"salt","notes":"divided between dough and filling","units":"tsp"},{"amount":1,"name":"garam masala","units":"tsp"},{"amount":0.5,"name":"ground cumin","units":"tsp"},{"amount":0.5,"name":"ground coriander","units":"tsp"},{"amount":0.25,"name":"turmeric powder","units":"tsp"},{"amount":0.5,"name":"black pepper","notes":"freshly ground","units":"tsp"}],"other":[{"amount":2,"name":"green cabbage","notes":"very finely minced","units":"cup"},{"amount":1,"name":"carrots","notes":"finely grated or minced","units":"cup"},{"amount":0.75,"name":"red onion","notes":"finely minced","units":"cup"},{"amount":0.5,"name":"scallions","notes":"finely chopped","units":"cup"},{"amount":1.5,"name":"garlic","notes":"minced","units":"Tbsp"},{"amount":1.5,"name":"fresh ginger","notes":"finely grated","units":"Tbsp"},{"amount":0.25,"name":"fresh cilantro","notes":"chopped","units":"cup"},{"amount":1,"name":"green chili","notes":"finely minced, optional for heat","units":"qty"}],"wet":[{"amount":130,"name":"water","notes":"lukewarm, adjust as needed for dough","units":"ml"},{"amount":2,"name":"vegetable oil","notes":"plus extra to grease the steamer","units":"Tbsp"},{"amount":1,"name":"soy sauce","units":"Tbsp"}]},"instructions":["In a mixing bowl, combine the all-purpose flour and 1/2 tsp salt. Gradually add lukewarm water and knead for 8 to 10 minutes until a smooth, firm, and pliable dough forms. Cover with a damp cloth and rest for 30 minutes.","Toss the minced cabbage with 1/4 tsp salt in a colander and let sit for 10 minutes. Squeeze out excess liquid thoroughly using your hands or a clean kitchen towel to prevent soggy dumplings.","In a large bowl, combine squeezed cabbage, grated carrots, red onion, scallions, garlic, ginger, cilantro, and green chili. Add garam masala, ground cumin, ground coriander, turmeric, black pepper, soy sauce, remaining 1/4 tsp salt, and 2 tbsp vegetable oil. Mix well to create the filling.","Knead the rested dough briefly, then divide it into small, equal-sized balls (about walnut-sized, roughly 20-24 pieces). Keep them covered with a damp cloth.","Roll out each dough ball on a lightly floured surface into a thin circular wrapper (around 3 to 3.5 inches in diameter), making the edges slightly thinner than the center.","Place 1 rounded tablespoon of filling into the center of a wrapper. Pleat the edges together in a circular pouch shape or half-moon crimp, pinching the top firmly to seal tightly.","Generously oil the steamer tiers or line them with perforated parchment paper. Arrange the momos inside with at least 1/2 inch of space between them to prevent sticking.","Bring water to a rolling boil in the steamer base. Place the momo tiers over the boiling water, cover tightly with the lid, and steam on medium-high heat for 10 to 12 minutes until the dough becomes slightly translucent and no longer sticky to the touch.","Carefully remove the momos with oiled tongs or wet fingers. Serve hot immediately alongside traditional Nepalese tomato-sesame momo achar."],"is_public":true,"name":"Steamed Nepalese Vegetable Momos","notes":"Squeezing the moisture out of the cabbage is critical to prevent the dough from tearing during steaming. You can also substitute part of the cabbage with finely minced cremini mushrooms or firm tofu for added texture and umami.","prepTime":50,"servings":4,"slug":"steamed-nepalese-vegetable-momos","stock_image_url":null,"tags":["nepalese","dumplings","steamed","vegan","appetizer","street-food","plant-based"]}
